{
  "$schema": "https://json-schema.org/draft/2020-12/schema",
  "type": "object",
  "additionalProperties": false,
  "required": [
    "schema_version",
    "id",
    "name",
    "theme",
    "settings",
    "memberships"
  ],
  "properties": {
    "schema_version": {
      "const": 1
    },
    "id": {
      "type": "string",
      "format": "uuid"
    },
    "name": {
      "type": "string",
      "minLength": 1,
      "maxLength": 80
    },
    "description": {
      "type": "string",
      "maxLength": 1024
    },
    "theme": {
      "type": "object",
      "required": [
        "mode",
        "accent"
      ],
      "additionalProperties": false,
      "properties": {
        "mode": {
          "enum": [
            "light",
            "dark",
            "system"
          ]
        },
        "accent": {
          "type": "string",
          "pattern": "^#[a-fA-F0-9]{6}$"
        },
        "density": {
          "enum": [
            "compact",
            "balanced",
            "comfortable"
          ]
        }
      }
    },
    "settings": {
      "type": "object",
      "maxProperties": 50
    },
    "memberships": {
      "type": "array",
      "maxItems": 10000,
      "uniqueItems": true,
      "items": {
        "type": "string",
        "format": "uuid"
      }
    },
    "membership_details": {
      "type": "array",
      "maxItems": 10000,
      "items": {
        "type": "object",
        "additionalProperties": false,
        "required": [
          "resource_id",
          "favorite",
          "sort_position"
        ],
        "properties": {
          "resource_id": {
            "type": "string",
            "format": "uuid"
          },
          "favorite": {
            "type": "boolean"
          },
          "category": {
            "type": [
              "string",
              "null"
            ],
            "maxLength": 80
          },
          "sort_position": {
            "type": "integer",
            "minimum": 0,
            "maximum": 1000000
          }
        }
      }
    },
    "smart_collections": {
      "type": "array",
      "maxItems": 100,
      "items": {
        "type": "object",
        "additionalProperties": false,
        "required": [
          "id",
          "name",
          "filters"
        ],
        "properties": {
          "id": {
            "type": "string",
            "format": "uuid"
          },
          "name": {
            "type": "string",
            "minLength": 1,
            "maxLength": 100
          },
          "filters": {
            "type": "object",
            "additionalProperties": false,
            "properties": {
              "resourceType": {
                "enum": [
                  "file",
                  "folder",
                  "app",
                  "shortcut",
                  "url"
                ]
              },
              "category": {
                "type": "string",
                "minLength": 1,
                "maxLength": 80
              },
              "tag": {
                "type": "string",
                "minLength": 1,
                "maxLength": 80
              },
              "favoriteOnly": {
                "type": "boolean"
              },
              "text": {
                "type": "string",
                "minLength": 1,
                "maxLength": 200
              }
            }
          }
        }
      }
    },
    "dynamic_shortcuts": {
      "type": "array",
      "maxItems": 100,
      "items": {
        "type": "object",
        "additionalProperties": false,
        "required": ["id", "name", "resource_id"],
        "properties": {
          "id": { "type": "string", "format": "uuid" },
          "name": { "type": "string", "minLength": 1, "maxLength": 100 },
          "resource_id": { "type": "string", "format": "uuid" },
          "target_id": { "type": "string", "format": "uuid" }
        }
      }
    }
  }
}
